<?xml version="1.0" encoding="UTF-8" standalone="no"?><application xmlns:xsi="http://www.w3.org/2001/XMLSchema-instance" xsi:noNamespaceSchemaLocation="CatalogueSchema.xsd">
	<catalogue dateCreation="2015-10-01" theme="CatalogueManil">
		<personne>
			<nomP>tata</nomP>
			<prenomP>tutu</prenomP>
		</personne>
		
		<photo datePrise="2015-10-01" lieu="Bordeaux" titre="Tour_Eiffel.jpg">
			<commentaire>il faisait beau</commentaire>
			<personne>
				<nomP>tata</nomP>
				<prenomP>tutu</prenomP>
			</personne>
		</photo>
		
		<photo datePrise="2015-10-01" lieu="Bordeaux" titre="statuedelaliberte.jpg">
			<commentaire>il faisait beau</commentaire>
			<personne>
				<nomP>tata</nomP>
				<prenomP>tutu</prenomP>
			</personne>
		</photo>

</catalogue>

</application>